{
  "_schema_version": "1.0",
  "company_name": "HWL Ebsworth Lawyers",
  "company_id": { "type": "ACN", "value": "246 549 189" },
  "jurisdictions": ["NSW"],
  "has_injunction": true,
  "injunctions": [
    {
      "court": "Supreme Court of NSW",
      "jurisdiction": "NSW",
      "type": "Interlocutory",
      "status": "Active",
      "filed_date": "2024-02-12",
      "case_number": "2023/00188190",
      "parties": ["HWL Ebsworth Lawyers v Persons Unknown"],
      "source_url": "https://www.caselaw.nsw.gov.au/decision/18d85d681e88798f7ef793b9"
    }
  ],
  "notes": "Verified against public court record. See source.",
  "last_reviewed": "2026-03-19"
}